{
  "accessed_at": "2026-07-31T07:23:11.973058Z",
  "citation": "European Southern Observatory, Paranal Ambient Conditions Database, Multi-Aperture Scintillation Sensor (MASS), January 2020 bounded snapshot; acknowledge ESO and cite Kornilov et al. (2007), MNRAS 382, 1268-1278.",
  "coverage": {
    "columns": 38,
    "query_interval": "2020-01-01..2020-02-01",
    "rows": 7857,
    "temporal_end": "2020-01-31T09:23:57",
    "temporal_start": "2020-01-01T00:34:31"
  },
  "dataset_id": "eso-paranal-mass-profile-2020-01-v1",
  "files": [
    {
      "bytes": 1655957,
      "relative_path": "data\\raw\\eso-paranal-mass\\canonical-v1\\mass-profile-2020-01.csv",
      "sha256": "737430b9fd764f5732664c02a16ae2601261c10dc9fb1b58edcb3dab631e7afc"
    },
    {
      "bytes": 1801,
      "relative_path": "data\\raw\\eso-paranal-mass\\canonical-v1\\request.json",
      "sha256": "9c43be4720af1b6225a487fdf6d2f98c2470a6f12985d41f3cf252fbdd900138"
    }
  ],
  "geometry": {
    "kind": "six_layer_profile_plus_ground_layer",
    "latitude_deg": -24.6167,
    "layer_heights_m": [
      0,
      500,
      1000,
      2000,
      4000,
      8000,
      16000
    ],
    "longitude_deg": -70.4,
    "observatory_altitude_m": 2635,
    "site": "Cerro Paranal"
  },
  "instrument": {
    "name": "Multi-Aperture Scintillation Sensor plus DIMM",
    "observation_operator": "scintillation inversion into integrated layer strengths",
    "wavelength_nm": 500
  },
  "label_provenance": "direct_observation",
  "qc": {
    "adapter": "eso_paranal_mass",
    "anonymous_https": true,
    "cadence_seconds": {
      "maximum": 400830.0,
      "median": 79.0,
      "p95": 98.0
    },
    "column_training_authorized": false,
    "columns": 38,
    "finite_counts": {
      "Airmass": 7857,
      "Averaged norm of residual": 7857,
      "Cn2 RMS": 7857,
      "Cn2 [10**(-15)m**(1/3)]": 7857,
      "Free Atmosphere Seeing RMS": 7857,
      "Free Atmosphere Seeing [\"]": 7857,
      "Layer 0 Cn2 RMS": 7857,
      "Layer 0 Cn2 [10**(-15)m**(1/3)]": 7857,
      "Layer 0 height [m]": 7857,
      "Layer 1 Cn2 RMS": 7857,
      "Layer 1 Cn2 [10**(-15)m**(1/3)]": 7857,
      "Layer 1 height [m]": 7857,
      "Layer 2 Cn2 RMS": 7857,
      "Layer 2 Cn2 [10**(-15)m**(1/3)]": 7857,
      "Layer 2 height [m]": 7857,
      "Layer 3 Cn2 RMS": 7857,
      "Layer 3 Cn2 [10**(-15)m**(1/3)]": 7857,
      "Layer 3 height [m]": 7857,
      "Layer 4 Cn2 RMS": 7857,
      "Layer 4 Cn2 [10**(-15)m**(1/3)]": 7857,
      "Layer 4 height [m]": 7857,
      "Layer 5 Cn2 RMS": 7857,
      "Layer 5 Cn2 [10**(-15)m**(1/3)]": 7857,
      "Layer 5 height [m]": 7857,
      "Layer 6 Cn2 RMS": 7857,
      "Layer 6 Cn2 [10**(-15)m**(1/3)]": 7857,
      "Layer 6 height [m]": 7857,
      "MASS Tau0 RMS": 7857,
      "MASS Tau0 [s]": 7857,
      "MASS Theta0 RMS": 7857,
      "MASS Theta0 [\"]": 7857,
      "MASS-DIMM Cn2 fraction at ground": 7857,
      "MASS-DIMM Seeing [\"]": 7857,
      "MASS-DIMM Tau0 [s]": 7785,
      "MASS-DIMM Theta0 [\"]": 7857,
      "MASS-DIMM Turb Velocity [m/s]": 7785,
      "Number of layers": 7857
    },
    "headers": [
      "Date time",
      "Free Atmosphere Seeing [\"]",
      "Free Atmosphere Seeing RMS",
      "MASS Tau0 [s]",
      "MASS Tau0 RMS",
      "MASS Theta0 [\"]",
      "MASS Theta0 RMS",
      "MASS-DIMM Cn2 fraction at ground",
      "MASS-DIMM Seeing [\"]",
      "MASS-DIMM Tau0 [s]",
      "MASS-DIMM Theta0 [\"]",
      "MASS-DIMM Turb Velocity [m/s]",
      "Airmass",
      "Averaged norm of residual",
      "Cn2 [10**(-15)m**(1/3)]",
      "Cn2 RMS",
      "Layer 1 Cn2 [10**(-15)m**(1/3)]",
      "Layer 1 Cn2 RMS",
      "Layer 1 height [m]",
      "Layer 2 Cn2 [10**(-15)m**(1/3)]",
      "Layer 2 Cn2 RMS",
      "Layer 2 height [m]",
      "Layer 3 Cn2 [10**(-15)m**(1/3)]",
      "Layer 3 Cn2 RMS",
      "Layer 3 height [m]",
      "Layer 4 Cn2 [10**(-15)m**(1/3)]",
      "Layer 4 Cn2 RMS",
      "Layer 4 height [m]",
      "Layer 5 Cn2 [10**(-15)m**(1/3)]",
      "Layer 5 Cn2 RMS",
      "Layer 5 height [m]",
      "Layer 6 Cn2 [10**(-15)m**(1/3)]",
      "Layer 6 Cn2 RMS",
      "Layer 6 height [m]",
      "Layer 0 Cn2 [10**(-15)m**(1/3)]",
      "Layer 0 Cn2 RMS",
      "Layer 0 height [m]",
      "Number of layers"
    ],
    "help_url": "https://archive.eso.org/wdb/help/eso/ambient_paranal.html",
    "layer_heights_m": [
      0.0,
      500.0,
      1000.0,
      2000.0,
      4000.0,
      8000.0,
      16000.0
    ],
    "license_url": "https://www.eso.org/public/science/archive/",
    "missing_counts": {
      "Airmass": 0,
      "Averaged norm of residual": 0,
      "Cn2 RMS": 0,
      "Cn2 [10**(-15)m**(1/3)]": 0,
      "Free Atmosphere Seeing RMS": 0,
      "Free Atmosphere Seeing [\"]": 0,
      "Layer 0 Cn2 RMS": 0,
      "Layer 0 Cn2 [10**(-15)m**(1/3)]": 0,
      "Layer 0 height [m]": 0,
      "Layer 1 Cn2 RMS": 0,
      "Layer 1 Cn2 [10**(-15)m**(1/3)]": 0,
      "Layer 1 height [m]": 0,
      "Layer 2 Cn2 RMS": 0,
      "Layer 2 Cn2 [10**(-15)m**(1/3)]": 0,
      "Layer 2 height [m]": 0,
      "Layer 3 Cn2 RMS": 0,
      "Layer 3 Cn2 [10**(-15)m**(1/3)]": 0,
      "Layer 3 height [m]": 0,
      "Layer 4 Cn2 RMS": 0,
      "Layer 4 Cn2 [10**(-15)m**(1/3)]": 0,
      "Layer 4 height [m]": 0,
      "Layer 5 Cn2 RMS": 0,
      "Layer 5 Cn2 [10**(-15)m**(1/3)]": 0,
      "Layer 5 height [m]": 0,
      "Layer 6 Cn2 RMS": 0,
      "Layer 6 Cn2 [10**(-15)m**(1/3)]": 0,
      "Layer 6 height [m]": 0,
      "MASS Tau0 RMS": 0,
      "MASS Tau0 [s]": 0,
      "MASS Theta0 RMS": 0,
      "MASS Theta0 [\"]": 0,
      "MASS-DIMM Cn2 fraction at ground": 0,
      "MASS-DIMM Seeing [\"]": 0,
      "MASS-DIMM Tau0 [s]": 72,
      "MASS-DIMM Theta0 [\"]": 0,
      "MASS-DIMM Turb Velocity [m/s]": 72,
      "Number of layers": 0
    },
    "observation_operator": "stellar-scintillation inversion to integrated MASS layer strengths; ground layer is DIMM minus MASS",
    "official_mlo_test_loaded": false,
    "profile_values_nonnegative": true,
    "raw_data_edited": false,
    "row_limit_reached": false,
    "rows": 7857,
    "status": "PASS",
    "temporal_end": "2020-01-31T09:23:57",
    "temporal_start": "2020-01-01T00:34:31",
    "timestamps_nondecreasing": true,
    "timestamps_unique": true,
    "unique_timestamps": 7857,
    "usna_confirmation_labels_loaded": false
  },
  "schema_version": 1,
  "source_url": "https://archive.eso.org/wdb/wdb/asm/mass_paranal/form",
  "terms": {
    "redistribution": "allowed",
    "status": "open"
  },
  "units": {
    "layer_height": "m above telescope pupil",
    "layer_strength": "10^-15 m^(1/3), archive integrated J_i units",
    "time": "UTC",
    "warning": "integrated layer strength, not pointwise Cn2"
  },
  "wavelength_nm": 500.0
}
