{
  "accessed_at": "2026-07-30T02:54:39.7176845Z",
  "citation": "Jellen, Nelson, Brownell, and Burkhardt (2024), Effective Benchmarks for Optical Turbulence Modeling, doi:10.1175/AIES-D-24-0003.1.",
  "coverage": {
    "features": 87,
    "partitions": {
      "test": 2449,
      "train": 5516,
      "validation": 1892
    },
    "rows": 9857,
    "source_rows": 14038,
    "temporal_end": "2006-08-08T09:57:30",
    "temporal_start": "2006-06-09T21:07:30"
  },
  "dataset_id": "otbench-mlo-cn2-15m-v1",
  "files": [
    {
      "bytes": 2120040,
      "relative_path": "data/raw/otbench/canonical-v1/otbench-mlo-cn2-15m-v1/test_features.csv",
      "sha256": "1d0a06ab6cfe883f378c127d3fb9fa0911eed80bb8f1fde0ac41c6380b0e425b"
    },
    {
      "bytes": 90636,
      "relative_path": "data/raw/otbench/canonical-v1/otbench-mlo-cn2-15m-v1/test_target.csv",
      "sha256": "3a83ad450f9badffc74be1fa94dec29265c42ecc1cf5d1b7ca3b61bcbe58a402"
    },
    {
      "bytes": 4788294,
      "relative_path": "data/raw/otbench/canonical-v1/otbench-mlo-cn2-15m-v1/train_features.csv",
      "sha256": "8a73c679549afcb14c3b68c26e38d1e8db06e53dab940da86e0882f7158a9466"
    },
    {
      "bytes": 204115,
      "relative_path": "data/raw/otbench/canonical-v1/otbench-mlo-cn2-15m-v1/train_target.csv",
      "sha256": "dd3aaad4119979f242a9656eade0feccf04b499cd703cb4923796b26d383c91b"
    },
    {
      "bytes": 511,
      "relative_path": "data/raw/otbench/canonical-v1/otbench-mlo-cn2-15m-v1/upstream/otbench/config/datasets.json",
      "sha256": "0b724b8cd6b816c9015572ca7829cfdf25565e7457afeff9abed1cad5cf9036d"
    },
    {
      "bytes": 8801,
      "relative_path": "data/raw/otbench/canonical-v1/otbench-mlo-cn2-15m-v1/upstream/otbench/config/tasks.json",
      "sha256": "011360d40f96bc60a51ae322bce06099cd888ba7a09d811b0b550437cc727095"
    },
    {
      "bytes": 5425009,
      "relative_path": "data/raw/otbench/canonical-v1/otbench-mlo-cn2-15m-v1/upstream/otbench/data/mlo_cn2/mlo_cn2.nc",
      "sha256": "5be133200dcc1e7da9ab1832a2fd2daf6a4de83afe0cf8dd1e4c33e47499b5ba"
    },
    {
      "bytes": 1636417,
      "relative_path": "data/raw/otbench/canonical-v1/otbench-mlo-cn2-15m-v1/validation_features.csv",
      "sha256": "9220a198dcf079666d2385601e7175963b7977e0dc5a5dd1f909b08cbf1de6f6"
    },
    {
      "bytes": 70027,
      "relative_path": "data/raw/otbench/canonical-v1/otbench-mlo-cn2-15m-v1/validation_target.csv",
      "sha256": "93d5e3efdfb411bf35a980bb2fef090bb0a7194b4012d5803e028aabc3e53792"
    }
  ],
  "geometry": {
    "kind": "surface_point",
    "latitude": 19.53,
    "longitude": -155.57,
    "observation_height_m": 15,
    "site": "Mauna Loa Observatory",
    "time_zone": "US/Hawaii"
  },
  "instrument": {
    "class": "ISFS sonic-anemometer and eddy-correlation surface system",
    "name": "MLO_CN2 15 m Cn2 channel",
    "processing_note": "The source NetCDF history records Cn2 editing against sonic sample counts; exact sensor serial and transfer function are not exposed by the pinned task metadata."
  },
  "label_provenance": "direct_observation",
  "qc": {
    "canonical_serialization": {
      "line_terminator": "LF",
      "maximum_allowed_task_difference": 2e-06,
      "target_decimal_places": 12,
      "target_log10_source": "exact upstream raw float32 observation"
    },
    "dropna_task": true,
    "label_detail": "Direct near-surface observation derived from the MLO_CN2 sonic/ISFS measurement system; it is not a WRF, LES, synthetic, or reanalysis teacher.",
    "wavelength_rationale": "Not applicable: the benchmark Cn2 channel is sonic/ISFS-derived rather than reported at an optical wavelength.",
    "task": "regression.mlo_cn2.dropna.Cn2_15m",
    "upstream_commit": "53cab9d53648b4870b43e35d48f19143786fa12e",
    "upstream_metadata_review_required_before_redistribution": true,
    "upstream_task_info": {
      "description": "Regression task for MLO Cn2 data, where the last 12 days are set aside for evaluation",
      "description_long": "This dataset evaluates regression approaches for predicting the extent of optical turbulence, as measured by Cn2 at an elevation of 15m. Optical turbulence on data collected at the Mauna Loa Solar Observatory between 27 July 2006 and 8 August 2006, inclusive, are used to evaluate prediction accuracy under the root-mean square error metric.",
      "dropna": true,
      "ds_name": "mlo_cn2",
      "eval_metrics": [
        "root_mean_square_error",
        "coefficient_of_determination",
        "mean_absolute_error",
        "mean_absolute_percentage_error"
      ],
      "log_transform": true,
      "obs_lat": 19.53,
      "obs_lon": -155.57,
      "obs_tz": "US/Hawaii",
      "remove": [
        "base_time",
        "Cn2_6m",
        "Cn2_15m",
        "Cn2_25m"
      ],
      "target": "Cn2_15m",
      "test_idx": [
        "10367:13943"
      ],
      "train_idx": [
        "0:8367"
      ],
      "val_idx": [
        "8367:10367"
      ]
    },
    "upstream_transforms": {
      "dropna": {
        "description": "Whether to drop observations with any missing values across both the features and target.",
        "value": true
      },
      "log_transform": {
        "description": "Whether to apply a base-10 log transform to the target.",
        "value": true
      }
    }
  },
  "schema_version": 1,
  "source_url": "https://github.com/CDJellen/otbench",
  "terms": {
    "redistribution": "metadata_only",
    "status": "review_required"
  },
  "units": {
    "raw_target": "m^(-2/3)",
    "target": "log10(m^(-2/3)), canonicalized from the upstream task's raw float32 observation"
  },
  "wavelength_nm": null
}
